{
  "schema": "swarms.task-state",
  "schema_version": 2,
  "run_id": "example-run",
  "task_id": "0000-build",
  "source_id": "build",
  "stage": "implementation",
  "role": "backend",
  "requested_route": "offline",
  "effective_route": "mock",
  "needs": [],
  "parent_task_id": null,
  "depth": 0,
  "status": "succeeded",
  "attempt": 1,
  "max_attempts": 1,
  "created_at": "2026-07-24T12:00:00Z",
  "started_at": "2026-07-24T12:00:01Z",
  "updated_at": "2026-07-24T12:00:03Z",
  "finished_at": "2026-07-24T12:00:03Z",
  "last_activity_at": "2026-07-24T12:00:03Z",
  "terminal_reason": "completed",
  "error": null,
  "worker_log": {
    "path": ".agent/example-run/tasks/0000-build/worker.log",
    "bytes": 128
  },
  "session": {
    "mode": "disabled",
    "reused": false,
    "public_id": null
  },
  "artifacts": [
    {
      "path": "output.txt",
      "status": "present",
      "message": null
    }
  ],
  "verification": [
    {
      "index": 0,
      "status": "passed",
      "exit_code": 0,
      "message": null
    }
  ],
  "usage": {
    "input_tokens": null,
    "output_tokens": null,
    "total_tokens": null,
    "source": "unavailable",
    "complete": false
  }
}
